{
  "schema_version": 1,
  "id": "000022",
  "lane": "bbd",
  "title": "Wiki 上传 UI：文件/文件夹 Web 上传，支持目录结构重建",
  "summary": "Wiki 支持文件/文件夹 Web 上传，保留目录结构，自动刷新树",
  "stories": [
    {
      "id": "a1b2c3d4-e5f6-7890-abcd-ef1234567890",
      "given": "Wiki panel 已打开",
      "when": "用户点击上传按钮并选择本地文件或文件夹",
      "then": "文件按 webkitRelativePath 结构上传到 wiki 目录，上传完成后 wiki 树自动刷新",
      "sample": "用户上传 projects/foo/bar/test.md，文件应保存到 projects/<project>/wiki/bar/test.md"
    }
  ],
  "risks": [
    {
      "id": "path-traversal",
      "description": "路径遍历攻击风险",
      "mitigation": "后端实现 path traversal 保护，阻止 .. 路径和绝对路径",
      "status": "mitigated"
    }
  ],
  "progress_record": [
    {
      "at": "2026-05-08",
      "summary": "Backend: POST /api/projects/{project}/wiki/upload multipart handler",
      "evidence": [
        "bb_server/http.rs"
      ]
    },
    {
      "at": "2026-05-08",
      "summary": "Backend: path traversal protection, directory creation, file write validation",
      "evidence": []
    },
    {
      "at": "2026-05-08",
      "summary": "Frontend: upload button in WikiPanel header, webkitdirectory support for folder uploads",
      "evidence": [
        "data/tickets.ts"
      ]
    },
    {
      "at": "2026-05-08",
      "summary": "Frontend: uploadWikiFiles() 实现",
      "evidence": [
        "data/tickets.ts"
      ]
    },
    {
      "at": "2026-05-08",
      "summary": "i18n: upload key added (zh: 上传, en: Upload)",
      "evidence": []
    }
  ],
  "attachments": [],
  "status": "archived",
  "created_at": "2026-05-08",
  "updated_at": "2026-05-12",
  "extra": {
    "assignee": "opencode",
    "depends_on": "000019"
  }
}
