{
  "schema_version": 1,
  "id": "000088",
  "lane": "bbt",
  "title": "飞书 Webhook 消息推送（TaskGraph 终态通知）",
  "summary": "为 Blackboard TaskGraph daemon 增加飞书 Webhook 终态通知的 MVP：当 graph run 以 Succeeded、Paused、Failed 结束时，按配置发送一张脱敏的飞书互动卡片；RunOutcome::Cancelled 必须被显式匹配，但本阶段不发送通知。Ticket 定义行为边界，implementation spec 负责具体实现、风险、测试和验收映射。",
  "stories": [
    {
      "id": "34d1f052-ff26-4c99-9150-c414e606f2fb",
      "given": "项目配置启用了 feishu 通知，并提供有效 webhook_url",
      "when": "TaskGraph run 结束为 Succeeded、Paused 或 Failed",
      "then": "daemon 在不改变原始 RunOutcome 的前提下调度一次非阻塞飞书 Webhook 推送，卡片包含项目、graph、run_id、终态、耗时和可选详情链接。"
    },
    {
      "id": "8f2aa40b-b85c-4a94-b559-4b8949790d9c",
      "given": "飞书 webhook 无效、不可达、超时，或飞书返回非成功状态/code",
      "when": "daemon 尝试发送终态通知",
      "then": "Blackboard 只记录脱敏 warning，不 panic，不阻塞 graph 结束，不改变原始 run 状态。"
    },
    {
      "id": "00a275ed-c012-4c57-acf6-f69e8953d481",
      "given": "运行结果为 RunOutcome::Cancelled",
      "when": "daemon 处理 graph 终态",
      "then": "代码必须显式匹配 Cancelled 分支并跳过飞书通知，避免未来新增分支或默认匹配造成误通知。"
    },
    {
      "id": "baeef068-dc6a-4413-a50a-3a50159a11c1",
      "given": "操作者运行 bb_cli feishu test-push",
      "when": "配置可用且飞书返回 HTTP 成功和业务 code=0",
      "then": "CLI 输出成功摘要；失败时输出脱敏错误并返回非 0，不打印完整 webhook URL。"
    },
    {
      "id": "0798d9aa-4144-4add-9a75-89f098d28c1e",
      "given": "配置缺失或 enabled=false",
      "when": "TaskGraph run 结束或操作者运行测试命令",
      "then": "daemon 不发送通知；测试命令给出明确的配置缺失/未启用提示。"
    }
  ],
  "risks": [
    {
      "id": "webhook-url-leak",
      "description": "webhook_url 包含敏感 token，日志、CLI、ticket/report 和错误链路可能泄露完整 URL。",
      "mitigation": "所有输出只显示 <redacted> 或 host 级信息；禁止在命令参数中传 webhook_url，测试覆盖错误日志脱敏。",
      "status": "open"
    },
    {
      "id": "async-runtime-boundary",
      "description": "daemon run 层和 TaskGraph runner 的同步/异步边界若不清晰，错误选择 tokio::spawn 会导致不可编译或取消语义不明确。",
      "mitigation": "当前 draft 已明确把 run_graph(...) 改为返回 GraphRunResult，并只在 daemon::run outcome 分支使用 std::thread::spawn + reqwest::blocking::Client 调度通知，不依赖 Tokio runtime。",
      "status": "mitigated"
    },
    {
      "id": "feishu-response-contract",
      "description": "飞书 rate limit、业务 code、空 body/非 JSON body 的真实协议行为需要官方文档或降级为防御性假设。",
      "mitigation": "最终 spec 中把未查证外部事实标为 hypothesis/open；实现只做保守错误处理，不把无引用假设写成事实。",
      "status": "open"
    },
    {
      "id": "card-json-malformed",
      "description": "互动卡片 JSON 构造错误会导致飞书拒绝请求。",
      "mitigation": "使用 serde_json::json!/Serialize 构造，添加 snapshot 或结构单测，避免字符串拼接。",
      "status": "open"
    }
  ],
  "progress_record": [],
  "attachments": [
    {
      "kind": "wiki",
      "target": "wiki/research/088-feishu-push-implementation-draft.md",
      "label": "Implementation Draft"
    },
    {
      "kind": "ticket",
      "target": "000093",
      "label": "Spec Arena dogfood"
    }
  ],
  "status": "in_progress",
  "created_at": "2026-05-28",
  "updated_at": "2026-05-28",
  "extra": {}
}
