{
  "schema_version": 1,
  "id": "000041",
  "lane": "bbd",
  "title": "Task Graph 前端：frontend-light-dark-fix 编辑页视觉优化与错误修复",
  "summary": "Task Graph 前端：frontend-light-dark-fix 编辑页视觉优化与错误修复",
  "stories": [
    {
      "id": "aff0e372-dc04-4e79-b17d-fb5b25bfb830",
      "given": "Task Graph 当前使用四向自由连接模型，节点没有显式声明 Pin，连线无法区分控制流和数据流",
      "when": "用户需要创建节点间连接或理解复杂图的执行流程",
      "then": "节点显式声明 InPin 和 OutPin，Pin 分 Exec（执行流）和 Data（数据流）两类，连线有方向约束且类型兼容"
    },
    {
      "id": "847f1b11-ec01-4d8b-a1a3-7b2b147b1723",
      "given": "系统中存在使用旧格式 JSON 的 Task Graph（没有 pins 字段）",
      "when": "系统加载这些旧格式 graph 文件",
      "then": "自动根据 node_type 生成默认 pins，保持向后兼容"
    }
  ],
  "risks": [],
  "progress_record": [
    {
      "at": "2026-05-09",
      "summary": "收紧 Task Graph 详情路由布局，压缩编辑器/运行面板大面积空白"
    },
    {
      "at": "2026-05-09",
      "summary": "移除 graph 卡片节点/边统计卡及预览页底部 meta"
    },
    {
      "at": "2026-05-09",
      "summary": "将 graph 卡片运行入口改成大按钮，展示运行动作/状态/最近运行时间"
    },
    {
      "at": "2026-05-09",
      "summary": "合并 RunPanel running/started/updated/elapsed/cursor 到标题区，running 图标增加动画"
    },
    {
      "at": "2026-05-09",
      "summary": "将 Task Graph mutation 异常改为 Alert 弹窗，移除全局 message 干扰"
    },
    {
      "at": "2026-05-09",
      "summary": "限制编辑态 catalog refresh 只刷新目录与运行历史，不再重载当前 graph"
    },
    {
      "at": "2026-05-09",
      "summary": "进入 edit 路由时清空 activeRunId，避免运行日志 stream 抢走编辑面板"
    },
    {
      "at": "2026-05-09",
      "summary": "TaskGraphCatalogPanel.vue 替换 hardcoded #fff 为 var(--bb-surface)，修复 dark mode 渲染"
    },
    {
      "at": "2026-05-09",
      "summary": "MarkdownRenderer.vue 添加 [data-theme='dark'] dark mode 语法高亮覆盖"
    },
    {
      "at": "2026-05-09",
      "summary": "TaskGraphRunPanel.vue 替换 hardcoded 中英文为 t() 调用"
    },
    {
      "at": "2026-05-09",
      "summary": "TaskGraphEditorPanel.vue 替换 6 个 hardcoded 按钮/标签为 t() 调用"
    },
    {
      "at": "2026-05-09",
      "summary": "新增 18 个 i18n key 到 bb_web/src/i18n.ts"
    },
    {
      "at": "2026-05-10",
      "summary": "修复 end 节点可接收连入连接"
    },
    {
      "at": "2026-05-10",
      "summary": "新增 pipeline i18n key 供 sub-pipeline inspector 使用"
    },
    {
      "at": "2026-05-10",
      "summary": "统一 Task Graph catalog 卡片密度规则，收敛 detail 路由小卡片尺寸为默认规格，沉淀到 DESIGN.md"
    },
    {
      "at": "2026-05-10",
      "summary": "将 catalog-card 运行状态从 footer 移至卡片 header 36px 状态方块，idle/pending/running/paused/succeeded/failed/cancelled 对应不同图标，移除重复卡片可见运行文字"
    },
    {
      "at": "2026-05-10",
      "summary": "缩小 Task Graph catalog 卡片标题字号与字重，紧凑标题与状态 badge 间距"
    },
    {
      "at": "2026-05-10",
      "summary": "将选中 graph 的 View/Edit/Customize 操作移至 preview header，放在 Run 按钮左侧；从左侧 catalog 卡片移除重复操作控件"
    },
    {
      "at": "2026-05-10",
      "summary": "将节点配置面板删除入口从 icon-only 改为带文案按钮；增加 Delete/Backspace 快捷键删除选中节点，同步移除关联边并清空选中状态"
    },
    {
      "at": "2026-05-10",
      "summary": "移除顶部持久创建横条表单，将新建 Project Graph 按钮移至 header；在 catalog 新增 modal card 创建流程，支持自动聚焦、Escape/背景关闭、提交后跳转编辑页"
    },
    {
      "at": "2026-05-10",
      "summary": "移除冗余的本地刷新入口，统一用全局 topbar 刷新；修复 top action 按钮盒模型使 icon-label 居中稳定；修复 UnifiedPopupSelect change handler 阻塞构建的 typo"
    },
    {
      "at": "2026-05-10",
      "summary": "新增 taskGraphPins.ts 承接 pin 颜色、默认生成、连接判定、canvas 投影和节点高度计算；taskGraphs.ts 保留 facade 导出"
    },
    {
      "at": "2026-05-10",
      "summary": "抽出 TaskGraphBindingList.vue 统一 prompt_vars 和 input_bindings 的 key/value 行、删除按钮和快捷绑定按钮；TaskGraphEditorPanel.vue 改为复用该组件"
    },
    {
      "at": "2026-05-10",
      "summary": "抽出 TaskGraphRunInputsPanel.vue 把运行输入预览控件、引用展示和盒模型样式集中到独立组件；TaskGraphCatalogPanel.vue 改为传入 inputs 与当前输入值"
    },
    {
      "at": "2026-05-10",
      "summary": "把流水线 Inputs 改为每个变量一整行，统一 cell 结构与盒模型避免溢出；Inputs 和 Graph 设置从并排改为上下两行布局"
    },
    {
      "at": "2026-05-10",
      "summary": "把 registered_task 节点的 prompt_vars 改为标准 binding row；key/value/删除按钮固定主行，引用按钮改为下一行 chip；sub_pipeline input_bindings 复用同一样式"
    },
    {
      "at": "2026-05-10",
      "summary": "抽出 TaskGraphInputsPanel.vue 把流水线 Inputs 模板、控件标准化逻辑和局部样式从 editor 主文件移出；EditorPanel 改为传入 graphInputs / isReadonly 并监听事件"
    },
    {
      "at": "2026-05-10",
      "summary": "MarkdownRenderer.vue 复用 slugifyHeading 消除 heading id 生成重复；新增 ui/wiki/render.ts 把 Wiki 渲染类型和 code markdown 包装逻辑从 WikiPanel.vue 移出；新增 views/boardViewUtils.ts 把 BoardView 状态转换和依赖解析移出"
    },
    {
      "at": "2026-05-10",
      "summary": "在 DESIGN.md 新增 Component Ownership And Reuse 规范和 Recurring Small Pitfalls 总结，补充 Graph Workbench 和 Implementation Checklist"
    },
    {
      "at": "2026-05-10",
      "summary": "修正 bbpm-maintain 和 bbpm-maintain-custom 中 max-iterations 空绑定为 {{inputs.inbox-max-iterations}}；让 sub_pipeline input_bindings 支持父 graph inputs 快捷绑定；在前端保存校验拦截空字符串 sub-pipeline input binding"
    },
    {
      "at": "2026-05-10",
      "summary": "在 DESIGN.md 补充 Notion-like productivity workbench 产品姿态说明；新增 Box Model And Control Grammar、Dense Editor Rows、Graph Workbench 规范；扩展 Implementation Checklist"
    },
    {
      "at": "2026-05-10",
      "summary": "修复 Task Graph 列表 failed 运行按钮样式为浅红底；将 route detail 左侧 catalog 改为局部滚动，按右侧 preview 高度收敛滚动条；补齐 i18n 类型索引"
    },
    {
      "at": "2026-05-10",
      "summary": "新增 --bb-theme-* 黑白主题语义 token 并桥接 TDesign 品牌色变量；将 Inbox 侧边栏 Badge、Task Graph 筛选 active、graph 选中态、run input reference 从青/蓝色收敛到黑白主题语义"
    },
    {
      "at": "2026-05-10",
      "summary": "移除 Run header 中 Run UI/API 标题、重复状态 pill，将 cursor UUID 替换为当前节点 label · type"
    },
    {
      "at": "2026-05-10",
      "summary": "收敛 Task Graph Run header 操作按钮与元信息 chip 圆角为 6px rounded box，统一 danger outline 按钮样式"
    },
    {
      "at": "2026-05-10",
      "summary": "移除顶部工具栏皮肤下拉入口，保留 Blackboard skin preset 作为内部主题基础设施；新增 task graph reference chip 语义 token；将编辑态 task-graph-variable-chip 与预览态 run input reference 统一到同一组黑白主题 token"
    }
  ],
  "attachments": [],
  "status": "archived",
  "created_at": "2026-05-09",
  "updated_at": "2026-05-10",
  "extra": {
    "area": "TaskGraph",
    "assignee": "codex",
    "depends_on": "000039",
    "kind": "frontend-polish",
    "parent": "000028",
    "scope": "bb_web-task-graph-editor"
  }
}
