{
  "schema_version": 1,
  "id": "000001",
  "lane": "bbp",
  "title": "Blackboard 产品基线：本地多 Agent 工具管理 Dashboard",
  "summary": "Blackboard 产品基线：本地多 Agent 工具管理 Dashboard",
  "stories": [
    {
      "id": "4650be1c-7189-43c7-b512-d1ed06fc8306",
      "given": "Blackboard 需要提供本地多 Agent 工具管理能力",
      "when": "用户使用 Blackboard 进行多 Agent 协作",
      "then": "实现统一的工作上下文可视化与管理"
    }
  ],
  "risks": [
    {
      "id": "risk-001",
      "description": "多 Agent 并发写入冲突：目前靠\"一次只一个 Agent 在写同一条 ticket\"的约定 + `next-ticket-id.sh` 的锁目录，尚未有强并发控制。",
      "status": "open"
    }
  ],
  "progress_record": [
    {
      "at": "2026-05-18",
      "summary": "project `blackboard` 已落地（`projects/blackboard/project.toml`、`.ticket-id`、空 inbox/tickets 骨架）。",
      "evidence": []
    },
    {
      "at": "2026-05-18",
      "summary": "本基线 ticket 首版写就，锁定\"本地多 Agent 工具管理 Dashboard\"的产品定位与 P0 能力边界。",
      "evidence": []
    },
    {
      "at": "2026-05-18",
      "summary": "竞品章节 2026-05-06 补调研：Paperclip（AI 公司控制平面）、Multica（Agent 当队友派 issue），明确 Blackboard 不走\"代管 Agent 执行\"的差异路线。",
      "evidence": []
    },
    {
      "at": "2026-05-18",
      "summary": "2026-05-06 增补 Agent 配置分发能力的事实源（`blackboard/agents/AGENTS.md`）并把详细 spec 拆到 `000002`（后端）/ `000003`（前端）两张子 ticket。基线 ticket 自身只保留指针，避免成为第二事实源。",
      "evidence": []
    },
    {
      "at": "2026-05-18",
      "summary": "后续子 ticket（多 Agent 心跳、看板按 Agent 视图、超期提醒、冒烟基线、IA 细化）待从基线展开并落号。",
      "evidence": []
    },
    {
      "at": "2026-05-18",
      "summary": "2026-05-06：Board preview 路由修复，Board 点击 card 改为导航到 `/projects/:project?preview=:id`，不再跳 Tickets 语境",
      "evidence": []
    },
    {
      "at": "2026-05-18",
      "summary": "2026-05-06：Dashboard 单页重构，Board/Tickets/Inbox 三个工作区合并为同一 Dashboard shell，新增 TicketDetailPanel 抽屉",
      "evidence": []
    },
    {
      "at": "2026-05-18",
      "summary": "2026-05-06：固定开发端口，后端 127.0.0.1:3001，前端 127.0.0.1:8060，更新 AGENTS.md",
      "evidence": []
    },
    {
      "at": "2026-05-18",
      "summary": "2026-05-06：preview panel 宽度从 `min(920px, 92vw)` 调整为 `min(1120px, calc(100vw - 72px))`",
      "evidence": []
    },
    {
      "at": "2026-05-18",
      "summary": "2026-05-06：响应式重叠修复，`.bb-dashboard-content` 增加 `container-type: inline-size`，kanban 列宽响应式断点 1180px/820px/560px",
      "evidence": []
    },
    {
      "at": "2026-05-18",
      "summary": "2026-05-06：ticket 拖拽，后端 PATCH `/api/projects/:project/tickets/:id` 持久化 bucket/status/lane，前端 HTML5 drag/drop 实现乐观更新",
      "evidence": []
    }
  ],
  "attachments": [],
  "status": "archived",
  "created_at": "2026-05-06",
  "updated_at": "2026-05-07",
  "extra": {
    "doc_type": "product-baseline"
  }
}
