{
  "schema_version": 1,
  "id": "000029",
  "lane": "bbp",
  "title": "Task Graph 前后端契约：模型、API 与运行态协议",
  "summary": "定义 Task Graph MVP 的前后端共同契约，覆盖 System/Project Graph catalog 语义、graph definition JSON schema、node/edge/control-flow schema、run snapshot/context schema、错误码与读写规则。",
  "stories": [
    {
      "id": "c3d4e5f6-a7b8-5c9d-0e1f-2a3b4c5d6e7f",
      "given": "Task Graph MVP 需要前后端并行开发",
      "when": "需要定义前后端共同遵守的数据模型、API 协议与运行态格式",
      "then": "后端可独立实现存储/执行，前端可用 mock/fixture 并行开发编辑器与运行态 UI"
    },
    {
      "id": "d4e5f6a7-b8c9-6d0e-1f2a-3b4c5d6e7f8a",
      "given": "契约文档已定稿",
      "when": "后端和前端按契约各自实现",
      "then": "000030-000038 均以该契约作为前后端并行开发依据"
    }
  ],
  "risks": [],
  "progress_record": [
    {
      "at": "2026-05-09",
      "summary": "已完成 Task Graph MVP 前后端契约文档，交付物位于 wiki/architecture/task-graph-mvp-contract.md",
      "evidence": [
        "wiki/architecture/task-graph-mvp-contract.md"
      ]
    },
    {
      "at": "2026-05-09",
      "summary": "契约覆盖 system/project graph 分层、graph definition、节点/边模型、Branch/Loop 控制流、API、run state、错误模型和三组 JSON 示例",
      "evidence": []
    },
    {
      "at": "2026-05-09",
      "summary": "已更新 wiki/index.md，将 Task Graph MVP 契约纳入 blackboard wiki 导航",
      "evidence": [
        "wiki/index.md"
      ]
    }
  ],
  "attachments": [],
  "status": "archived",
  "created_at": "2026-05-09",
  "updated_at": "2026-05-09",
  "extra": {
    "area": "TaskGraph",
    "assignee": "codex",
    "deliverable": "wiki/architecture/task-graph-mvp-contract.md",
    "depends_on": "000028",
    "kind": "contract",
    "parent": "000028"
  }
}
